{
  "$schema": "http://json-schema.org/draft-07/schema#",
  "title": "Orion Ledger Lifecycle Marker",
  "description": "Marcador do lifecycle do Feature Ledger (ADR-0022 / #114). Enumera o legado pré-ADR-0022 — entradas fora da obrigação de flip (§d). O corte é por ENUMERAÇÃO (número de issue não serve: #87–#108 são pré-ADR-0022 apesar de > #85). Ausente = sem legado (repo derivado: todo local é sob-regime).",
  "type": "object",
  "additionalProperties": false,
  "required": ["regimeAdr", "adoptedOn", "legacySha256", "legacyEntryIds"],
  "properties": {
    "regimeAdr": {
      "type": "string",
      "minLength": 1,
      "description": "ADR que instituiu o regime de flip (ex.: \"ADR-0022\")."
    },
    "adoptedOn": {
      "type": "string",
      "pattern": "^\\d{4}-\\d{2}-\\d{2}$",
      "description": "Data ISO (YYYY-MM-DD) de adoção do regime."
    },
    "legacySha256": {
      "type": "string",
      "pattern": "^sha256:[0-9a-f]{64}$",
      "description": "Fingerprint do subconjunto legado (tamper-evidence)."
    },
    "legacyEntryIds": {
      "type": "array",
      "items": { "type": "string" },
      "description": "Ids pré-ADR-0022 — enumeração explícita e permanente, fora da obrigação de flip."
    },
    "supersededEntryIds": {
      "type": "array",
      "description": "Entradas PÓS-regime cujo critério é superseded/mal-redigido e não pode ser honestamente flipado (ADR-0027). DISTINTA do legado: cada item traz `reason` obrigatório e `sha` (fingerprint da entrada específica). Append-only e imutável (guard). Excluídas da obrigação de flip: o `--scoped` NÃO as conta como 'aguardando flip'.",
      "items": {
        "type": "object",
        "additionalProperties": false,
        "required": ["id", "reason", "sha"],
        "properties": {
          "id": {
            "type": "string",
            "minLength": 1,
            "description": "Id da entrada do ledger excluída (pós-ADR-0022)."
          },
          "reason": {
            "type": "string",
            "minLength": 1,
            "description": "Motivo documentado e obrigatório (ex.: critério mal-redigido, D2 substantivo cumprido)."
          },
          "sha": {
            "type": "string",
            "pattern": "^sha256:[0-9a-f]{64}$",
            "description": "Fingerprint dos campos imutáveis da entrada específica (lifecycleFingerprint([entry])) — tamper-evidence: fixa o critério mal-redigido, impede troca silenciosa."
          }
        }
      }
    },
    "note": { "type": "string" }
  }
}
