{
  "regimeAdr": "ADR-0022",
  "adoptedOn": "2026-07-28",
  "legacySha256": "sha256:57a23c719bc837c441bdd6674d71811a0e5ee08ad50fdd223722146064b088a7",
  "legacyEntryIds": [
    "F-0029-06b997",
    "F-0029-0806d3",
    "F-0029-3df859",
    "F-0029-57e944",
    "F-0029-70895d",
    "F-0029-83f716",
    "F-0031-84e54e",
    "F-0031-90eedb",
    "F-0031-913c62",
    "F-0032-733ea6",
    "F-0032-8a6368",
    "F-0032-ee9f0b",
    "F-0033-044c1a",
    "F-0033-3c3cf8",
    "F-0033-dceb6a",
    "F-0043-0c6a69",
    "F-0043-444568",
    "F-0043-baad42",
    "F-0043-f2d333",
    "F-0043-f387a4",
    "F-0045-4a6485",
    "F-0045-5df9fe",
    "F-0045-b9017a",
    "F-0045-dc698c",
    "F-0051-14758b",
    "F-0051-9df38c",
    "F-0051-a8af0a",
    "F-0051-ae23b7",
    "F-0052-07e58d",
    "F-0052-08300b",
    "F-0052-3753e2",
    "F-0052-cb12c4",
    "F-0052-f23ce7",
    "F-0053-4337ff",
    "F-0053-492f70",
    "F-0053-73ea54",
    "F-0053-a76425",
    "F-0053-f5062c",
    "F-0062-4660bf",
    "F-0062-4af946",
    "F-0062-7c22b3",
    "F-0062-a9caf3",
    "F-0062-f1bda0",
    "F-0067-159082",
    "F-0067-195e70",
    "F-0067-37d748",
    "F-0071-3750b4",
    "F-0071-535519",
    "F-0071-6d08c3",
    "F-0073-547de9",
    "F-0073-579af2",
    "F-0073-7ac0ba",
    "F-0073-9dbb52",
    "F-0074-09ac07",
    "F-0074-5084de",
    "F-0074-617c40",
    "F-0074-a45e2d",
    "F-0075-4e7a74",
    "F-0075-509267",
    "F-0075-c18b64",
    "F-0075-e25824",
    "F-0083-025a46",
    "F-0083-6d0206",
    "F-0087-6e2fa3",
    "F-0087-8e09b1",
    "F-0087-a2b6b2",
    "F-0087-b9c598",
    "F-0087-c27f6c",
    "F-0089-1dfe0d",
    "F-0089-69dbc2",
    "F-0089-852232",
    "F-0089-b254d6",
    "F-0089-d4b74f",
    "F-0089-e0fbe9",
    "F-0091-1c63d8",
    "F-0091-8fdaa5",
    "F-0091-cfacbc",
    "F-0091-d580c7",
    "F-0091-d95c91",
    "F-0093-09903a",
    "F-0093-1f487a",
    "F-0094-01644d",
    "F-0094-23a9df",
    "F-0094-358223",
    "F-0094-a37d35",
    "F-0094-ad6aea",
    "F-0096-4eb5e9",
    "F-0096-5467d0",
    "F-0096-9efedb",
    "F-0098-5b6a87",
    "F-0098-bf36b9",
    "F-0098-da3415",
    "F-0103-1a080f",
    "F-0103-2342d7",
    "F-0103-4f5fcf",
    "F-0103-7e02af",
    "F-0106-0d4ec1",
    "F-0106-172a86",
    "F-0106-f0b997",
    "F-0107-392f05",
    "F-0107-53adf3",
    "F-0107-5b8d7d",
    "F-0108-00148f",
    "F-0108-3e3f4b",
    "F-0108-609038"
  ],
  "supersededEntryIds": [
    {
      "id": "F-0143-8b069c",
      "reason": "Critério mal-redigido (ADR-0027): o texto exige 'role dos 2 arquivos atualizado', mas a entrega D2 de #143 mudou só o `note` das entradas do manifesto — o `role` seguiu `pointer` corretamente (um ponteiro repontado continua pointer). O trabalho D2 substantivo foi feito; só a *palavra* do critério não bate. A flip é irreversível (ADR-0022 §c), então não se flipa (não registrar conclusão falsa — Codex #154 P1); exclui-se por este mecanismo. Ver lição de processo em #155 (critério deve ser literalmente verificável pelo efeito real, não por um campo que pode legitimamente não mudar).",
      "sha": "sha256:daed99e17a096cfca24672f510dd1279a905eb93bb1c3c387ea2e4c5d6853a69"
    },
    {
      "id": "F-0207-b41939",
      "reason": "Critério mal-redigido (ADR-0027): o texto exige que skill/templates/tabela 'onde cada conceito mora' reflitam o v2 'no mesmo PR do ADR'. Mas o ADR-0031 foi entregue decision-only (PRs #210/#211) por desenho de governança (ADR-decide-não-aplica); a aplicação foi fatiada para as irmãs #217/#218. A cláusula 'no mesmo PR do ADR' é contrafactual e não pode ser honestamente flipada (a flip é irreversível — ADR-0022 §c; não registrar conclusão falsa — Codex #154 P1). O trabalho substantivo foi feito e está gravado `true` sob #217 (F-0217-332585/fc2a15/1a1c5e). Análogo ao precedente F-0143-8b069c; lição #155 (critério deve ser literalmente verificável pelo efeito real).",
      "sha": "sha256:bc26deb954807c32c6a94731acb5ec25d38b78ffcb0c680a8e812466c848aadd"
    },
    {
      "id": "F-0158-e8662f",
      "reason": "Critério mal-redigido (ADR-0027): o texto afirma 'o diff só adiciona `tools/history/`', mas toda fatia toca obrigatoriamente STATE.md (ponteiro) e feature-ledger.json (entradas born-false) — o PR de entrega #159 tocou ambos além de tools/history/. A alegação central (read-path intacto: CHANGELOG.md/AGENTS.md §4/espelhos) é verdadeira e foi verificada, mas o parêntese literal não é cumprível por nenhuma fatia. A flip é irreversível (ADR-0022 §c), então não se flipa (não registrar conclusão falsa — Codex #154 P1). Decisão já tomada no flip original #161 (commit d6bae45: 'fica false, critério diff só adiciona literalmente não cumprido, precedente #143'); este registro apenas a formaliza no mecanismo. Análogo a F-0143-8b069c/F-0207-b41939; lição #155.",
      "sha": "sha256:80e08125aa545e80fc2c83282607cb2f79a9c182e672fe41d96875b6bbc76792"
    },
    {
      "id": "F-0206-565d5e",
      "reason": "Critério mal-escopado (ADR-0027): o critério 4 de #206 exige o Project como projeção derivada COM as fontes de evento (Issue/branch/PR aberto/mergeado) estabelecidas. Mas #206 (T10.1) é decision-only: o ADR-0033 DECIDE o modelo derivado e ADIA explicitamente o mapa de transição/fontes para a fatia T10.3 (§4). O critério, como redigido, nunca poderia ser cumprido dentro de #206 — flipar registraria conclusão falsa (Codex #247 P1), e deixá-lo false trava o WIP=1 (#206 esperaria T10.3, que espera #206). Re-escopado: a projeção derivada com fontes é entrega de T10.3, verificável lá. A DECISÃO (Project derivado, não-autoral, fonte na Issue/ledger) está feita e mergeada (#246). Análogo a F-0207-b41939; lição #155 (critério literalmente verificável pelo efeito real da sua fatia).",
      "sha": "sha256:ab649b0ab8866a9c9bd87e1bcb6b7efdc8a2c6c3b3b087bb8764e7aa4c575d8d"
    },
    {
      "id": "F-0272-ce5006",
      "reason": "Critério mal-redigido (ADR-0027): o texto exige o projetor atuar como **App** ('Escritor único (App projetor)'). Mas o Project 7 é user-owned e um installation-token de GitHub App NÃO alcança Projects v2 de conta de usuário (confirmado no deploy do T10.3: 'Could not resolve to a ProjectV2 with the number 7'); o projetor passou a autenticar com um PAT do usuário (PROJECTS_TOKEN, #279). O substantivo do critério — escritor ÚNICO de Status + automações nativas de Status desligadas — foi entregue e VERIFICADO ao vivo (Blocked/Done corretos no board). Só a palavra 'App' é contrafactual, e é permanente para board de conta de usuário. A flip é irreversível (ADR-0022 §c), então não se flipa (não registrar conclusão falsa — Codex #280 P1). Análogo a F-0207-b41939/F-0143-8b069c; lição #155 (critério literalmente verificável pelo efeito real).",
      "sha": "sha256:1d6ab449868b3268a8fa7dd04b03ec585145ab5fb3e4a22209dadb0c40f6e854"
    }
  ],
  "note": "Duas exclusões da obrigação de flip. (1) legacyEntryIds: entradas pré-ADR-0022 (legado) — corte por ENUMERAÇÃO (número de issue não serve: #87–#108 são pré-ADR-0022 apesar de > #85, pois mergearam antes), análogo a inheritedEntryIds (ADR-0021): explícita, enumerada, permanente. (2) supersededEntryIds (ADR-0027): entradas PÓS-regime cujo critério é superseded/mal-redigido e não pode ser honestamente flipado — motivo obrigatório + sha da entrada específica; append-only e imutável (guard). Nenhuma inunda o get-bearings como 'aguardando flip'."
}
